{"evidence":{"adoptedParameterSetId":"K06824.01:cumulative","chemicalClaims":[],"citations":[{"authors":[],"bibliographicId":null,"doi":"10.26133/NEA4","id":"K06824.01:koi-record","lastVerifiedAt":"2026-09-13T14:32:49.801770+00:00","publicationDate":null,"publisher":"NASA Exoplanet Archive / Caltech-IPAC","redistributionNote":"NASA Exoplanet Archive public catalogue subset; acknowledge the archive and original publications.","retrievedAt":"2026-09-13T14:23:16.672595+00:00","selection":"K06824.01","snapshotHash":"f8a103bc9b98849b11ea03339edd16c56d628c76dffe425129a35bbcc36b8fae","sourceType":"catalogue","title":"Kepler Objects of Interest — Cumulative Table","url":"https://exoplanetarchive.ipac.caltech.edu/TAP/sync?query=select+*+from+cumulative+where+kepoi_name%3D%27K06824.01%27&format=json"}],"claims":[{"citationIds":["K06824.01:koi-record"],"dependenceGroupId":"K06824.01:catalogue-disposition","id":"K06824.01:identity","objectId":"K06824.01","observationEpoch":null,"review":"accepted","sourceLocator":"kepoi_name=K06824.01; koi_disposition; koi_vet_date=2018-08-16 00:00:00","statement":"The archive classifies K06824.01 as false positive."},{"citationIds":["K06824.01:koi-record"],"dependenceGroupId":"K06824.01:Kepler transit data","id":"K06824.01:cumulative:parameters","objectId":"K06824.01","observationEpoch":null,"review":"accepted","sourceLocator":"kepoi_name=K06824.01; stellar parameters=q1_q17_dr25_stellar","statement":"Adopted parameter solution: Mandel and Agol (2002 ApJ 580 171). Values retain their field definitions, limits and reported uncertainties."},{"citationIds":["K06824.01:koi-record"],"dependenceGroupId":"K06824.01:Kepler transit data","id":"K06824.01:cumulative:radius:claim","objectId":"K06824.01","observationEpoch":null,"review":"accepted","sourceLocator":"kepoi_name=K06824.01; stellar parameters=q1_q17_dr25_stellar; koi_prad","statement":"The selected solution reports transit-fit planet radius, dependent on stellar parameters in field koi_prad."},{"citationIds":["K06824.01:koi-record"],"dependenceGroupId":"K06824.01:Kepler transit data","id":"K06824.01:cumulative:orbitalPeriod:claim","objectId":"K06824.01","observationEpoch":null,"review":"accepted","sourceLocator":"kepoi_name=K06824.01; stellar parameters=q1_q17_dr25_stellar; koi_period","statement":"The selected solution reports orbital period from the published fit in field koi_period."},{"citationIds":["K06824.01:koi-record"],"dependenceGroupId":"K06824.01:Kepler transit data","id":"K06824.01:cumulative:semiMajorAxis:claim","objectId":"K06824.01","observationEpoch":null,"review":"accepted","sourceLocator":"kepoi_name=K06824.01; stellar parameters=q1_q17_dr25_stellar; koi_sma","statement":"The selected solution reports orbital semi-major axis, not projected separation in field koi_sma."},{"citationIds":["K06824.01:koi-record"],"dependenceGroupId":"K06824.01:Kepler transit data","id":"K06824.01:cumulative:equilibriumTemperature:claim","objectId":"K06824.01","observationEpoch":null,"review":"accepted","sourceLocator":"kepoi_name=K06824.01; stellar parameters=q1_q17_dr25_stellar; koi_teq","statement":"The selected solution reports equilibrium temperature under the publication assumptions; not surface temperature in field koi_teq."},{"citationIds":["K06824.01:koi-record"],"dependenceGroupId":"K06824.01:Kepler transit data","id":"K06824.01:cumulative:hostTemperature:claim","objectId":"K06824.01","observationEpoch":null,"review":"accepted","sourceLocator":"kepoi_name=K06824.01; stellar parameters=q1_q17_dr25_stellar; koi_steff","statement":"The selected solution reports host stellar effective temperature from fitted stellar parameters in field koi_steff."},{"citationIds":["K06824.01:koi-record"],"dependenceGroupId":"K06824.01:Kepler transit data","id":"K06824.01:cumulative:hostRadius:claim","objectId":"K06824.01","observationEpoch":null,"review":"accepted","sourceLocator":"kepoi_name=K06824.01; stellar parameters=q1_q17_dr25_stellar; koi_srad","statement":"The selected solution reports host stellar radius from fitted stellar parameters in field koi_srad."},{"citationIds":["K06824.01:koi-record"],"dependenceGroupId":"K06824.01:Kepler transit data","id":"K06824.01:cumulative:hostMass:claim","objectId":"K06824.01","observationEpoch":null,"review":"accepted","sourceLocator":"kepoi_name=K06824.01; stellar parameters=q1_q17_dr25_stellar; koi_smass","statement":"The selected solution reports host stellar mass from fitted stellar parameters in field koi_smass."},{"citationIds":["K06824.01:koi-record"],"dependenceGroupId":"K06824.01:Kepler transit data","id":"K06824.01:cumulative:transitDepth:claim","objectId":"K06824.01","observationEpoch":null,"review":"accepted","sourceLocator":"kepoi_name=K06824.01; stellar parameters=q1_q17_dr25_stellar; koi_depth","statement":"The selected solution reports fractional loss of stellar light in the adopted transit model in field koi_depth."},{"citationIds":["K06824.01:koi-record"],"dependenceGroupId":"K06824.01:Kepler transit data","id":"K06824.01:cumulative:radiusRatio:claim","objectId":"K06824.01","observationEpoch":null,"review":"accepted","sourceLocator":"kepoi_name=K06824.01; stellar parameters=q1_q17_dr25_stellar; koi_ror","statement":"The selected solution reports planet-to-star radius ratio from transit fit in field koi_ror."}],"coverage":{"lastReviewedAt":"2026-09-13T14:32:49.801770+00:00","notIngested":["surface maps","atmospheric pressure profiles","visible reflectance spectra","planetary rotation","ring and moon constraints"],"scope":"Selected catalogue solutions and individually reviewed supplements. Literature coverage is incomplete.","sourceTables":["cumulative"]},"coverageState":"reviewed_subset","generatorHashes":{"optics":"8113ad4635d0b73afbea4032fc382eda25750a96ec33409585820f4d0aa7e579","physics":"4131df1d5db04dc4016fec9067efcd9924b98d6337bb959120010917d14b2084","recipes":"cb110515506f792ecd1fac5608067b7e06071348b3e9b3f338f8ddaf23f79c7a","terrain":"675aaf9f9ed72ae38afbb827907a4c3cebca6a228a9c081b8b2865c3f8a5a440"},"modelRuns":[{"applicability":"valid","assumptionIds":[],"evidenceReleaseId":"2026-09-13-6e7401e7de308492","id":"K06824.01:cumulative:derive-hostLuminosity","inputQuantityIds":["K06824.01:cumulative:hostRadius","K06824.01:cumulative:hostTemperature"],"modelId":"effective-temperature-luminosity","modelVersion":"1","numericalSettings":{"constantsVersion":"SI-2019_IAU-2015_CODATA-2018","uncertainty":"reported-bound endpoint envelope"},"outputHash":"c5a57861d0856ad863a8dacf7eaf9df05d14712fd456d4e056d67514d14cd01f","priorIds":[],"validation":{"method":"Positive finite SI inputs from the same published parameter solution; domain and assumptions stated in the output quantity definition.","passed":true,"uncertainty":"Reported-bound envelope or explicitly absent uncertainty."}},{"applicability":"valid","assumptionIds":[],"evidenceReleaseId":"2026-09-13-6e7401e7de308492","id":"K06824.01:cumulative:derive-irradiance","inputQuantityIds":["K06824.01:cumulative:derived-hostLuminosity","K06824.01:cumulative:semiMajorAxis"],"modelId":"host-irradiance-at-reference-separation","modelVersion":"1","numericalSettings":{"constantsVersion":"SI-2019_IAU-2015_CODATA-2018","uncertainty":"reported-bound endpoint envelope"},"outputHash":"420dcf0fe66673957fb372ce09110f0b3d8c301777333cb87288373224e5ed72","priorIds":[],"validation":{"method":"Positive finite SI inputs from the same published parameter solution; domain and assumptions stated in the output quantity definition.","passed":true,"uncertainty":"Reported-bound envelope or explicitly absent uncertainty."}}],"object":{"aliases":[],"canonicalName":"K06824.01","evidenceReleaseId":"2026-09-13-6e7401e7de308492","existence":{"evidenceClaimIds":["K06824.01:identity"],"previousAssessmentId":"K06824.01:previous-website-snapshot","rationale":"The archive classifies K06824.01 as false positive.","reviewedAt":"2026-09-13T14:32:49.801770+00:00","status":"false_positive"},"hostAssociationClaimIds":["K06824.01:identity"],"hostLabel":"Kepler input target 7115597","id":"K06824.01","quantityIds":["K06824.01:cumulative:radius","K06824.01:cumulative:mass","K06824.01:cumulative:orbitalPeriod","K06824.01:cumulative:semiMajorAxis","K06824.01:cumulative:eccentricity","K06824.01:cumulative:equilibriumTemperature","K06824.01:cumulative:hostTemperature","K06824.01:cumulative:hostRadius","K06824.01:cumulative:hostMass","K06824.01:cumulative:hostLuminosity","K06824.01:cumulative:distance","K06824.01:cumulative:transitDepth","K06824.01:cumulative:radiusRatio","K06824.01:cumulative:pressure","K06824.01:cumulative:surfaceTemperature","K06824.01:cumulative:derived-hostLuminosity","K06824.01:cumulative:irradiance"],"schemaVersion":"1.0.0"},"parameterSets":[{"id":"K06824.01:cumulative","label":"Kepler cumulative transit solution","publicationDate":null,"quantityIds":["K06824.01:cumulative:radius","K06824.01:cumulative:mass","K06824.01:cumulative:orbitalPeriod","K06824.01:cumulative:semiMajorAxis","K06824.01:cumulative:eccentricity","K06824.01:cumulative:equilibriumTemperature","K06824.01:cumulative:hostTemperature","K06824.01:cumulative:hostRadius","K06824.01:cumulative:hostMass","K06824.01:cumulative:distance","K06824.01:cumulative:transitDepth","K06824.01:cumulative:radiusRatio","K06824.01:cumulative:pressure","K06824.01:cumulative:surfaceTemperature","K06824.01:cumulative:derived-hostLuminosity","K06824.01:cumulative:irradiance"],"selectionReason":"Use this internally named Kepler fit; preserve its stellar assumptions. Do not supplement missing fields from another solution.","sourceUpdatedAt":"2018-08-16 00:00:00"}],"previousWebsiteStatus":"FALSE POSITIVE","quantities":[{"assumptionIds":[],"constraint":{"errorMinus":956715,"errorPlus":2742583,"kind":"estimate","uncertainty":{"covarianceId":null,"distributionAssetId":null,"interpretation":"reported_unspecified","level":null},"value":9822274},"definition":"transit-fit planet radius, dependent on stellar parameters","epistemicKind":"inferred","